{
  "version": 2,
  "packageName": "dev.taphound.demo",
  "launchActivity": "dev.taphound.demo.MainActivity",
  "manifest": {
    "version": 1,
    "files": [
      {
        "path": "settings.gradle.kts",
        "sha256": "20982fed45806089e62a011a3350acea7f50ae02c4b82e6004555f889bcbdf86",
        "semanticSha256": "7d50eda437d7aa70c14fb4b9032d6e0ab344a8b6b1c6061c67268b9e800a6da5",
        "confidence": "sourceConfirmed"
      }
    ]
  },
  "interactionPolicy": {
    "allowedActions": [
      "click",
      "longClick",
      "inputText",
      "swipe",
      "scrollTo",
      "back",
      "wait"
    ],
    "confirmationRequiredActions": [],
    "forbiddenActions": []
  },
  "modules": [
    {
      "id": ":app",
      "projectDir": "app",
      "kind": "application",
      "contextPath": ".taphound/context/modules/app.json",
      "sha256": "af90930c338d13ce2288963c9bfb7ca30656564fd867a5540c5c16a951b361b1",
      "features": [
        "launch",
        "search",
        "compose",
        "hybrid"
      ],
      "activities": [
        "dev.taphound.demo.MainActivity",
        "dev.taphound.demo.SearchActivity",
        "dev.taphound.demo.ComposeActivity",
        "dev.taphound.demo.HybridActivity"
      ],
      "dependsOn": [],
      "status": "complete"
    }
  ]
}
